{
  "$schema": "https://json-schema.org/draft/2020-12/schema",
  "title": "Floor ROI Spec",
  "type": "object",
  "additionalProperties": false,
  "required": ["floor_id", "stream_path", "seats"],
  "properties": {
    "floor_id": { "type": "string", "minLength": 1 },
    "stream_path": { "type": "string", "minLength": 1 },
    "frame_size": {
      "type": "array",
      "minItems": 2,
      "maxItems": 2,
      "items": { "type": "integer", "minimum": 1 }
    },
    "seats": {
      "type": "array",
      "minItems": 1,
      "items": {
        "type": "object",
        "additionalProperties": false,
        "required": ["seat_id", "has_power", "desk_roi"],
        "properties": {
          "seat_id": { "type": "string", "minLength": 1 },
          "has_power": { "type": ["integer", "boolean"] },
          "desk_roi": {
            "type": "array",
            "minItems": 3,
            "items": {
              "type": "array",
              "minItems": 2,
              "maxItems": 2,
              "items": { "type": "number" }
            }
          }
        }
      }
    }
  }
}


