{
  "floor_id": "F2",
  "stream_path": "input/test/F2.mp4",
  "frame_size": [
    1920,
    1080
  ],
  "seats": [
    {
      "seat_id": "F2-01",
      "has_power": 0,
      "desk_roi": [
        [
          936,
          550
        ],
        [
          132,
          537
        ],
        [
          138,
          1041
        ],
        [
          928,
          1048
        ],
        [
          939,
          549
        ]
      ]
    },
    {
      "seat_id": "F2-02",
      "has_power": 1,
      "desk_roi": [
        [
          942,
          549
        ],
        [
          1754,
          560
        ],
        [
          1772,
          1040
        ],
        [
          927,
          1046
        ],
        [
          945,
          549
        ]
      ]
    },
    {
      "seat_id": "F2-03",
      "has_power": 0,
      "desk_roi": [
        [
          130,
          540
        ],
        [
          942,
          564
        ],
        [
          950,
          266
        ],
        [
          148,
          237
        ],
        [
          132,
          538
        ]
      ]
    },
    {
      "seat_id": "F2-04",
      "has_power": 0,
      "desk_roi": [
        [
          945,
          564
        ],
        [
          1752,
          574
        ],
        [
          1728,
          250
        ],
        [
          951,
          246
        ],
        [
          944,
          564
        ]
      ]
    }
  ]
}